{
  "$schema": "https://json-schema.org/draft/2020-12/schema",
  "$id": "https://outreach.local/contracts/extraction.schema.json",
  "title": "Extractor output (raw, from the LLM) — UNTRUSTED until verified by code",
  "description": "Response format of prompts/extractor/v1. Used as response_format json_schema. Every quote must be verbatim from the page; code checks with literalIn() and drops what is not literal. Code (not the model) parses dates, normalizes identifiers and decides status.",
  "type": "object",
  "additionalProperties": false,
  "required": ["page_type", "about", "evidence", "mentions", "official_links"],
  "properties": {
    "page_type": { "$ref": "common.schema.json#/$defs/pageType" },
    "about": {
      "description": "The single opportunity this page is primarily about, or null if it is not about one (lists, news about many, unrelated).",
      "oneOf": [
        { "type": "null" },
        {
          "type": "object",
          "additionalProperties": false,
          "required": ["name", "issuer_name", "issuer_domain", "identifier_texts", "date_mentions", "amount_text", "instrument", "how_to_apply_quote", "status_quote"],
          "properties": {
            "name": { "type": "string", "minLength": 2, "maxLength": 200 },
            "issuer_name": { "type": "string", "maxLength": 200 },
            "issuer_domain": { "type": ["string", "null"], "maxLength": 100, "description": "Domain of the organization that runs the opportunity, if the page shows it; null otherwise." },
            "identifier_texts": { "type": "array", "maxItems": 6, "items": { "type": "string", "minLength": 3, "maxLength": 60 }, "description": "Official numbers/codes as written on the page (e.g. 'RFA-AG-27-010', 'NSF 23-525')." },
            "date_mentions": {
              "type": "array", "maxItems": 12,
              "items": {
                "type": "object", "additionalProperties": false,
                "required": ["label", "quote"],
                "properties": {
                  "label": { "type": "string", "maxLength": 80, "description": "What the date is for, as written (Letter of Intent, full proposal, deadline, webinar...)." },
                  "quote": { "type": "string", "minLength": 4, "maxLength": 300 }
                }
              }
            },
            "amount_text": { "type": ["string", "null"], "maxLength": 200 },
            "instrument": { "$ref": "common.schema.json#/$defs/instrument" },
            "how_to_apply_quote": { "type": ["string", "null"], "maxLength": 400 },
            "status_quote": { "type": ["string", "null"], "maxLength": 400 }
          }
        }
      ]
    },
    "evidence": {
      "type": "array", "maxItems": 20,
      "items": {
        "type": "object", "additionalProperties": false,
        "required": ["criterion_id", "quote", "binding", "requirement_summary"],
        "properties": {
          "criterion_id": { "type": "string", "pattern": "^((G|P)-[A-Z]+|REQ)$", "description": "Catalog id, or 'REQ' for a call-specific requirement not covered by the catalog." },
          "quote": { "type": "string", "minLength": 8, "maxLength": 600 },
          "binding": { "type": "boolean", "description": "true when the text is a requirement (must, required, only, eligible, not eligible)." },
          "requirement_summary": { "type": ["string", "null"], "maxLength": 300, "description": "Required (non-null) when criterion_id='REQ'." }
        }
      }
    },
    "mentions": {
      "type": "array", "maxItems": 10,
      "description": "Other named programs/calls on the page (leads for the planner, never counted as opportunities).",
      "items": {
        "type": "object", "additionalProperties": false,
        "required": ["name", "identifier_text"],
        "properties": {
          "name": { "type": "string", "minLength": 2, "maxLength": 200 },
          "identifier_text": { "type": ["string", "null"], "maxLength": 60 }
        }
      }
    },
    "official_links": {
      "type": "array", "maxItems": 8,
      "description": "Links present in the page text that point to the official call document (NOFO, guidelines PDF, application portal). URL must appear literally in the page text.",
      "items": {
        "type": "object", "additionalProperties": false,
        "required": ["anchor_text", "url"],
        "properties": {
          "anchor_text": { "type": "string", "maxLength": 160 },
          "url": { "type": "string", "maxLength": 500 }
        }
      }
    }
  }
}
